{
  "schema": "ewoh:///git-sync/v1",
  "generatedAt": "2026-08-03T20:45:45.392Z",
  "repository": "git@github.com:qq547820639/EWOH.git",
  "branch": "codex/ewoh-iteration-2026-08-04",
  "headSha": "4194f5fdadb0e951a6b7ffc5640e4b98fccd73f4",
  "itemCount": 216,
  "trackedCount": 0,
  "missingCount": 216,
  "status": "offline",
  "source": ".codex/artifacts/work/git-sync.json",
  "items": [
    {
      "workItemId": "T-001",
      "title": "Read authoritative docs",
      "type": "task",
      "status": "Done",
      "owner": "AG-00",
      "evidence": "`.codex/artifacts/authoritative-plan.txt`, `final-implementation-plan.txt`",
      "wave": "W0 - Baseline, Contracts, Probes (current)",
      "issueNumber": null,
      "prNumber": null,
      "branch": null,
      "commitSha": null,
      "state": "unlinked",
      "missing": true
    },
    {
      "workItemId": "T-002",
      "title": "Repo/module/table inventory",
      "type": "task",
      "status": "In Progress",
      "owner": "AG-00 + explorers",
      "evidence": "`inventory/*.md`",
      "wave": "W0 - Baseline, Contracts, Probes (current)",
      "issueNumber": null,
      "prNumber": null,
      "branch": null,
      "commitSha": null,
      "state": "unlinked",
      "missing": true
    },
    {
      "workItemId": "T-003",
      "title": "Environment probes",
      "type": "task",
      "status": "In Progress",
      "owner": "AG-10",
      "evidence": "`inventory/environment.md`",
      "wave": "W0 - Baseline, Contracts, Probes (current)",
      "issueNumber": null,
      "prNumber": null,
      "branch": null,
      "commitSha": null,
      "state": "unlinked",
      "missing": true
    },
    {
      "workItemId": "T-004",
      "title": "C1 data contract",
      "type": "task",
      "status": "Refining",
      "owner": "AG-03",
      "evidence": "`contracts/data-contract.md`",
      "wave": "W0 - Baseline, Contracts, Probes (current)",
      "issueNumber": null,
      "prNumber": null,
      "branch": null,
      "commitSha": null,
      "state": "unlinked",
      "missing": true
    },
    {
      "workItemId": "T-005",
      "title": "C2 API contract",
      "type": "task",
      "status": "Refining",
      "owner": "AG-04",
      "evidence": "`contracts/api-contract.md`",
      "wave": "W0 - Baseline, Contracts, Probes (current)",
      "issueNumber": null,
      "prNumber": null,
      "branch": null,
      "commitSha": null,
      "state": "unlinked",
      "missing": true
    },
    {
      "workItemId": "T-006",
      "title": "C3 state machines",
      "type": "task",
      "status": "Refining",
      "owner": "AG-05",
      "evidence": "`contracts/state-machines.md`",
      "wave": "W0 - Baseline, Contracts, Probes (current)",
      "issueNumber": null,
      "prNumber": null,
      "branch": null,
      "commitSha": null,
      "state": "unlinked",
      "missing": true
    },
    {
      "workItemId": "T-007",
      "title": "C4 security contract",
      "type": "task",
      "status": "Refining",
      "owner": "AG-06",
      "evidence": "`contracts/security-contract.md`",
      "wave": "W0 - Baseline, Contracts, Probes (current)",
      "issueNumber": null,
      "prNumber": null,
      "branch": null,
      "commitSha": null,
      "state": "unlinked",
      "missing": true
    },
    {
      "workItemId": "T-008",
      "title": "C5 UI contract",
      "type": "task",
      "status": "Refining",
      "owner": "AG-30",
      "evidence": "`contracts/ui-contract.md`",
      "wave": "W0 - Baseline, Contracts, Probes (current)",
      "issueNumber": null,
      "prNumber": null,
      "branch": null,
      "commitSha": null,
      "state": "unlinked",
      "missing": true
    },
    {
      "workItemId": "T-009",
      "title": "C6 DevOps contract",
      "type": "task",
      "status": "Refining",
      "owner": "AG-51",
      "evidence": "`contracts/devops-contract.md`",
      "wave": "W0 - Baseline, Contracts, Probes (current)",
      "issueNumber": null,
      "prNumber": null,
      "branch": null,
      "commitSha": null,
      "state": "unlinked",
      "missing": true
    },
    {
      "workItemId": "T-010",
      "title": "Requirements traceability",
      "type": "task",
      "status": "Refining",
      "owner": "AG-01/41",
      "evidence": "`contracts/requirements-trace.md`",
      "wave": "W0 - Baseline, Contracts, Probes (current)",
      "issueNumber": null,
      "prNumber": null,
      "branch": null,
      "commitSha": null,
      "state": "unlinked",
      "missing": true
    },
    {
      "workItemId": "T-011",
      "title": "Logical capability -> physical table map",
      "type": "task",
      "status": "Refining",
      "owner": "AG-03/10",
      "evidence": "`contracts/data-contract.md`",
      "wave": "W0 - Baseline, Contracts, Probes (current)",
      "issueNumber": null,
      "prNumber": null,
      "branch": null,
      "commitSha": null,
      "state": "unlinked",
      "missing": true
    },
    {
      "workItemId": "T-012",
      "title": "Baseline test harness fix",
      "type": "task",
      "status": "Validation",
      "owner": "AG-10/51",
      "evidence": "`inventory/environment.md`, Makefile, package.json, test.yml",
      "wave": "W0 - Baseline, Contracts, Probes (current)",
      "issueNumber": null,
      "prNumber": null,
      "branch": null,
      "commitSha": null,
      "state": "unlinked",
      "missing": true
    },
    {
      "workItemId": "T-013",
      "title": "DDL/migration package generation",
      "type": "task",
      "status": "Validation",
      "owner": "AG-10",
      "evidence": "`db/`, `tmp/ddl/`, runner plan mode OK; live DDL pending",
      "wave": "W0 - Baseline, Contracts, Probes (current)",
      "issueNumber": null,
      "prNumber": null,
      "branch": null,
      "commitSha": null,
      "state": "unlinked",
      "missing": true
    },
    {
      "workItemId": "T-014",
      "title": "Backend shared infrastructure",
      "type": "task",
      "status": "Validation",
      "owner": "AG-11",
      "evidence": "7 Jest suites / 18 tests pass; type check pass",
      "wave": "W0 - Baseline, Contracts, Probes (current)",
      "issueNumber": null,
      "prNumber": null,
      "branch": null,
      "commitSha": null,
      "state": "unlinked",
      "missing": true
    },
    {
      "workItemId": "T-015",
      "title": "Frontend 11-center shell",
      "type": "task",
      "status": "Review",
      "owner": "AG-30",
      "evidence": "11 routes, grouped Layout, placeholders, namespaces, queryKeys",
      "wave": "W0 - Baseline, Contracts, Probes (current)",
      "issueNumber": null,
      "prNumber": null,
      "branch": null,
      "commitSha": null,
      "state": "unlinked",
      "missing": true
    },
    {
      "workItemId": "T-016",
      "title": "Drizzle schema codegen sync to live DB (18 tables)",
      "type": "task",
      "status": "Done",
      "owner": "AG-10/codegen",
      "evidence": "`server/database/schema.ts` 556 lines, type check pass",
      "wave": "W2 - Master Data Domains (started)",
      "issueNumber": null,
      "prNumber": null,
      "branch": null,
      "commitSha": null,
      "state": "unlinked",
      "missing": true
    },
    {
      "workItemId": "T-017",
      "title": "Organization/personnel backend module",
      "type": "task",
      "status": "Validation",
      "owner": "AG-12",
      "evidence": "`server/modules/organization/`, 2 tests, type check pass",
      "wave": "W2 - Master Data Domains (started)",
      "issueNumber": null,
      "prNumber": null,
      "branch": null,
      "commitSha": null,
      "state": "unlinked",
      "missing": true
    },
    {
      "workItemId": "T-018",
      "title": "Command center + personnel real-data pages",
      "type": "task",
      "status": "Review",
      "owner": "AG-31/32",
      "evidence": "CommandCenter/Personnel pages fetch APIs, type check pass",
      "wave": "W2 - Master Data Domains (started)",
      "issueNumber": null,
      "prNumber": null,
      "branch": null,
      "commitSha": null,
      "state": "unlinked",
      "missing": true
    },
    {
      "workItemId": "T-019",
      "title": "Device search extension (available fields + pagination + binding filter)",
      "type": "task",
      "status": "Validation",
      "owner": "AG-13",
      "evidence": "`/api/dashboard/devices/search`, 2 tests",
      "wave": "W2 - Master Data Domains (started)",
      "issueNumber": null,
      "prNumber": null,
      "branch": null,
      "commitSha": null,
      "state": "unlinked",
      "missing": true
    },
    {
      "workItemId": "T-020",
      "title": "Model registry management module",
      "type": "task",
      "status": "Validation",
      "owner": "AG-15",
      "evidence": "`/api/models`, lifecycle transition tests",
      "wave": "W2 - Master Data Domains (started)",
      "issueNumber": null,
      "prNumber": null,
      "branch": null,
      "commitSha": null,
      "state": "unlinked",
      "missing": true
    },
    {
      "workItemId": "T-021",
      "title": "Role guard + sensitive personnel endpoint",
      "type": "task",
      "status": "Validation",
      "owner": "AG-06/12",
      "evidence": "`@Roles` guard, `/api/personnel/:id/sensitive`, tests",
      "wave": "W2 - Master Data Domains (started)",
      "issueNumber": null,
      "prNumber": null,
      "branch": null,
      "commitSha": null,
      "state": "unlinked",
      "missing": true
    },
    {
      "workItemId": "T-022",
      "title": "System config module with credential masking",
      "type": "task",
      "status": "Validation",
      "owner": "AG-21",
      "evidence": "`/api/system/config`, masking tests",
      "wave": "W2 - Master Data Domains (started)",
      "issueNumber": null,
      "prNumber": null,
      "branch": null,
      "commitSha": null,
      "state": "unlinked",
      "missing": true
    },
    {
      "workItemId": "T-023",